[
  {
    "resource_id": "dial.rules.tooling-policy",
    "name": "DIAL Tooling Use Policy",
    "source_id": "dial.project",
    "resource_class": "RULESET",
    "authority": "PROJECT_LOCAL_ENGINEERING_POLICY",
    "status": "ACTIVE",
    "activation_mode": "PROCESS_RULE",
    "locator": "docs/dial/final-audit/06_DEVELOPMENT_SYSTEM/TOOLING_USE_POLICY.md",
    "task_classes": [
      "*"
    ],
    "technologies": [],
    "keywords": [
      "tool",
      "plugin",
      "donor",
      "security",
      "testing"
    ],
    "forbidden_effects": []
  },
  {
    "resource_id": "dial.hook.pre-tool-guard",
    "name": "DIAL pre-tool guard",
    "source_id": "dial.project",
    "resource_class": "HOOK",
    "authority": "PROJECT_LOCAL_ENGINEERING_POLICY",
    "status": "ACTIVE",
    "activation_mode": "PROCESS_RULE",
    "locator": "agent-system/hooks/pre-tool-guard.mjs",
    "task_classes": [
      "*"
    ],
    "technologies": [],
    "keywords": [
      "write",
      "edit",
      "guard",
      "tool"
    ],
    "forbidden_effects": []
  },
  {
    "resource_id": "dial.loop.mission-controller",
    "name": "DIAL persistent mission loop",
    "source_id": "dial.project",
    "resource_class": "WORKFLOW_LOOP",
    "authority": "PROJECT_LOCAL_ENGINEERING_POLICY",
    "status": "ACTIVE",
    "activation_mode": "PROCESS_RULE",
    "locator": "agent-system/orchestration/mission-controller.mjs",
    "task_classes": [
      "*"
    ],
    "technologies": [
      "Hermes"
    ],
    "keywords": [
      "mission",
      "orchestration",
      "autonomous",
      "loop"
    ],
    "forbidden_effects": []
  },
  {
    "resource_id": "dial.tool.context7",
    "name": "Context7 documentation resolver",
    "source_id": "dial.project",
    "resource_class": "TOOL",
    "authority": "PROJECT_LOCAL_ENGINEERING_POLICY",
    "status": "POLICY_APPROVED_CONDITIONAL",
    "activation_mode": "READ_ONLY_TOOL",
    "locator": "connector:Context7",
    "task_classes": [
      "DEPENDENCY_RESEARCH",
      "API_RESEARCH",
      "BUILD_TOOLING"
    ],
    "technologies": [],
    "keywords": [
      "dependency",
      "version",
      "api",
      "docs"
    ],
    "requires_tools": [
      "Context7"
    ],
    "forbidden_effects": [
      "CHANGE_PRODUCT_REQUIREMENTS",
      "BYPASS_DONOR_GATE"
    ]
  },
  {
    "resource_id": "dial.tool.exa",
    "name": "Exa external engineering research",
    "source_id": "dial.project",
    "resource_class": "TOOL",
    "authority": "PROJECT_LOCAL_ENGINEERING_POLICY",
    "status": "POLICY_APPROVED_CONDITIONAL",
    "activation_mode": "READ_ONLY_TOOL",
    "locator": "connector:Exa",
    "task_classes": [
      "EXTERNAL_RESEARCH",
      "DEPENDENCY_RESEARCH",
      "SECURITY_RESEARCH"
    ],
    "technologies": [],
    "keywords": [
      "research",
      "current",
      "external",
      "documentation"
    ],
    "requires_tools": [
      "Exa"
    ],
    "forbidden_effects": [
      "CHANGE_PRODUCT_REQUIREMENTS",
      "TREAT_SEARCH_RESULT_AS_AUTHORITY"
    ]
  },
  {
    "resource_id": "ref.nextjs.docs",
    "name": "Next.js documentation",
    "source_id": "official.nextjs",
    "resource_class": "OFFICIAL_DOC",
    "authority": "ENGINEERING_GUIDANCE_ONLY",
    "status": "REFERENCE_APPROVED",
    "activation_mode": "REFERENCE_ONLY",
    "locator": "https://nextjs.org/docs",
    "seed_urls": [
      "https://nextjs.org/docs",
      "https://nextjs.org/docs/llms.txt"
    ],
    "task_classes": [
      "WEB_UI_IMPLEMENTATION",
      "WEB_ROUTING",
      "WEB_SECURITY"
    ],
    "technologies": [
      "Next.js",
      "React"
    ],
    "keywords": [
      "app router",
      "server component",
      "route handler",
      "csp",
      "nextjs"
    ],
    "forbidden_effects": [
      "CHANGE_PRODUCT_REQUIREMENTS"
    ]
  },
  {
    "resource_id": "ref.react.docs",
    "name": "React documentation",
    "source_id": "official.react",
    "resource_class": "OFFICIAL_DOC",
    "authority": "ENGINEERING_GUIDANCE_ONLY",
    "status": "REFERENCE_APPROVED",
    "activation_mode": "REFERENCE_ONLY",
    "locator": "https://react.dev/",
    "seed_urls": [
      "https://react.dev/"
    ],
    "task_classes": [
      "WEB_UI_IMPLEMENTATION",
      "WEB_STATE_MANAGEMENT"
    ],
    "technologies": [
      "React"
    ],
    "keywords": [
      "react",
      "component",
      "hook",
      "state"
    ],
    "forbidden_effects": [
      "CHANGE_PRODUCT_REQUIREMENTS"
    ]
  },
  {
    "resource_id": "ref.typescript.docs",
    "name": "TypeScript documentation",
    "source_id": "official.typescript",
    "resource_class": "OFFICIAL_DOC",
    "authority": "ENGINEERING_GUIDANCE_ONLY",
    "status": "REFERENCE_APPROVED",
    "activation_mode": "REFERENCE_ONLY",
    "locator": "https://www.typescriptlang.org/docs/",
    "seed_urls": [
      "https://www.typescriptlang.org/docs/"
    ],
    "task_classes": [
      "TYPESCRIPT_IMPLEMENTATION",
      "BUILD_TOOLING"
    ],
    "technologies": [
      "TypeScript"
    ],
    "keywords": [
      "typescript",
      "strict",
      "nodenext",
      "types"
    ],
    "forbidden_effects": [
      "CHANGE_PRODUCT_REQUIREMENTS"
    ]
  },
  {
    "resource_id": "ref.supabase.docs",
    "name": "Supabase documentation",
    "source_id": "official.supabase",
    "resource_class": "OFFICIAL_DOC",
    "authority": "ENGINEERING_GUIDANCE_ONLY",
    "status": "REFERENCE_APPROVED",
    "activation_mode": "REFERENCE_ONLY",
    "locator": "https://supabase.com/docs",
    "seed_urls": [
      "https://supabase.com/docs"
    ],
    "task_classes": [
      "DATABASE",
      "AUTH",
      "RLS_SECURITY",
      "POSTGRES",
      "STORAGE"
    ],
    "technologies": [
      "Supabase",
      "PostgreSQL"
    ],
    "keywords": [
      "rls",
      "auth",
      "postgres",
      "storage",
      "supabase"
    ],
    "forbidden_effects": [
      "CREATE_SECOND_SOR",
      "EXPAND_AUTHORITY"
    ]
  },
  {
    "resource_id": "ref.postgresql.docs",
    "name": "PostgreSQL current documentation",
    "source_id": "official.postgresql",
    "resource_class": "OFFICIAL_DOC",
    "authority": "ENGINEERING_GUIDANCE_ONLY",
    "status": "REFERENCE_APPROVED",
    "activation_mode": "REFERENCE_ONLY",
    "locator": "https://www.postgresql.org/docs/current/",
    "seed_urls": [
      "https://www.postgresql.org/docs/current/"
    ],
    "task_classes": [
      "DATABASE",
      "POSTGRES",
      "SQL",
      "RLS_SECURITY"
    ],
    "technologies": [
      "PostgreSQL"
    ],
    "keywords": [
      "postgres",
      "sql",
      "transaction",
      "rls",
      "index"
    ],
    "forbidden_effects": [
      "CREATE_SECOND_SOR"
    ]
  },
  {
    "resource_id": "ref.playwright.docs",
    "name": "Playwright documentation",
    "source_id": "official.playwright",
    "resource_class": "OFFICIAL_DOC",
    "authority": "ENGINEERING_GUIDANCE_ONLY",
    "status": "REFERENCE_APPROVED",
    "activation_mode": "REFERENCE_ONLY",
    "locator": "https://playwright.dev/docs/intro",
    "seed_urls": [
      "https://playwright.dev/docs/intro"
    ],
    "task_classes": [
      "E2E_TESTING",
      "WEB_UI_VERIFICATION",
      "BROWSER_AUTOMATION"
    ],
    "technologies": [
      "Playwright"
    ],
    "keywords": [
      "playwright",
      "e2e",
      "browser",
      "locator"
    ],
    "forbidden_effects": [
      "SELF_CERTIFY_GATE"
    ]
  },
  {
    "resource_id": "ref.vitest.docs",
    "name": "Vitest documentation",
    "source_id": "official.vitest",
    "resource_class": "OFFICIAL_DOC",
    "authority": "ENGINEERING_GUIDANCE_ONLY",
    "status": "REFERENCE_APPROVED",
    "activation_mode": "REFERENCE_ONLY",
    "locator": "https://vitest.dev/guide/",
    "seed_urls": [
      "https://vitest.dev/guide/"
    ],
    "task_classes": [
      "UNIT_TESTING",
      "TYPESCRIPT_TESTING"
    ],
    "technologies": [
      "Vitest"
    ],
    "keywords": [
      "vitest",
      "unit test",
      "mock",
      "coverage"
    ],
    "forbidden_effects": [
      "SELF_CERTIFY_GATE"
    ]
  },
  {
    "resource_id": "ref.zod.docs",
    "name": "Zod documentation",
    "source_id": "official.zod",
    "resource_class": "OFFICIAL_DOC",
    "authority": "ENGINEERING_GUIDANCE_ONLY",
    "status": "REFERENCE_APPROVED",
    "activation_mode": "REFERENCE_ONLY",
    "locator": "https://zod.dev/",
    "seed_urls": [
      "https://zod.dev/"
    ],
    "task_classes": [
      "SCHEMA_VALIDATION",
      "TYPESCRIPT_IMPLEMENTATION"
    ],
    "technologies": [
      "Zod"
    ],
    "keywords": [
      "zod",
      "schema",
      "validation"
    ],
    "forbidden_effects": []
  },
  {
    "resource_id": "ref.maplibre.docs",
    "name": "MapLibre GL JS documentation",
    "source_id": "official.maplibre",
    "resource_class": "OFFICIAL_DOC",
    "authority": "ENGINEERING_GUIDANCE_ONLY",
    "status": "REFERENCE_APPROVED",
    "activation_mode": "REFERENCE_ONLY",
    "locator": "https://maplibre.org/maplibre-gl-js/docs/",
    "seed_urls": [
      "https://maplibre.org/maplibre-gl-js/docs/"
    ],
    "task_classes": [
      "DELIVERY_MAPS",
      "MAP_RENDERING"
    ],
    "technologies": [
      "MapLibre"
    ],
    "keywords": [
      "maplibre",
      "map",
      "style",
      "marker",
      "layer"
    ],
    "forbidden_effects": [
      "REPLACE_LOCKED_MAP_STACK"
    ]
  },
  {
    "resource_id": "ref.osrm.repo",
    "name": "OSRM backend repository",
    "source_id": "official.osrm",
    "resource_class": "REPOSITORY",
    "authority": "ENGINEERING_GUIDANCE_ONLY",
    "status": "REFERENCE_APPROVED",
    "activation_mode": "REFERENCE_ONLY",
    "locator": "https://github.com/Project-OSRM/osrm-backend",
    "repository": "Project-OSRM/osrm-backend",
    "task_classes": [
      "DELIVERY_MAPS",
      "ROUTING"
    ],
    "technologies": [
      "OSRM"
    ],
    "keywords": [
      "osrm",
      "routing",
      "route",
      "table"
    ],
    "forbidden_effects": [
      "CREATE_DELIVERY_SOR"